{
  "$schema": "../../../schemas/ingestion/v2/evaluation.schema.json",
  "schema_version": 1,
  "recording": {
    "enabled": true,
    "directory": "../../../artifacts/ingestion-observations",
    "include_payloads": false
  },
  "golden_dataset": null,
  "metrics": {
    "requirement_grounding": true,
    "vector_retrieval": true,
    "graph_retrieval": true,
    "mapping_precision": true,
    "mapping_recall": true
  }
}
